화면 인덱스|텍스트|배경 이미지|캐릭터 이미지|사운드 파일명|효과음 파일명|1번 선택지|1번 선택 시 이동 씬|2번 선택지|2번 선택 시 이동 씬|연출 효과 요청
212|"나는 그 사람의 얼굴을 확인했다. 그는 광장에서 나를 노려봤던 올리버였다. 
올리버: 내가 아니었으면 당신은 죽을뻔했어요..! 어쩌자고 휴고 뒤를 캐신 거예요! 
저... 저는 그저 미트파이 재료가 궁금해서.... 
나는 올리버의 말에 말을 더듬으며 대답했다. 
올리버: ... 중증이네요.. 이미 많이 중독됐어... 
네? 중독이요? 
올리버: 그래요. 중독. 이 마을에서 제공하는 미트파이는 방금 보셨다시피 사람을 재료로 하는 인육 미트파이예요. 
!!! 
올리버: 그리고 요리사가 미트파이를 제작하는 도중에 중독을 일으키는 마약 약초를 함께 첨가해서 한번 먹으면 끊을 수 없게 만들구요. 
약초..? 설마 그때 그 약초밭이... 
올리버: 이미 약초밭을 보셨나요?? 그곳이 그 약초들을 재배하는 곳이에요. 
그 약초를 계속해서 복용하다 보면... 마약처럼 중독 현상을 일으키게 되고.. 계속해서 미트파이를 갈망하게 만들어요 
내가 그럼 요즘 미트파이를 자꾸 먹고 싶어 하는 게... 약초.. 때문..? 그 맛있는 미트파이를..? 
잠깐만.. 그럼 올리버는 이런 사실을 알면서도 왜 조용히 있던 거지..? 그리고 중독은 왜 안 된 거 같지..? 
올리버: ... 저는 우연히 그 약초를 중화시킬 수 있는 다른 약초를 발견해서... 
그것을 복용하여 정신은 차리게 됐지만.. 인육을 먹은지 오래돼서 제 몸은 완전히 망가진 상태였고, 아무것도 할 수 없었어요... 
올리버: 저는 그래서 이 마을에 이사 오는 사람들이 미트파이의 진실을 알아냈을 때 
몰래 중화시키는 약초를 먹이고 도망가게 해주고 있었어요... 
충격에 빠져 멍하니 있는 나에게 올리버는 상황을 설명해 주었다. 
그렇다면... 저는 아직 중독이 덜 돼서... 도망갈.. 수 있다는 건가요..?
올리버: ... 제가 보기에 이미 중증인 것 같긴 하지만... 이 약초를 꾸준히 먹고 의성의 끈을 놓지만 않는다면...
충분히 원래 생활로 돌아갈 수 있을 것 같아요."|SCENE_STORY_OUTSIDE(LOAD_HELL).jpg|CHARACTER_OLIVER_HELL.png||||213|||
213|"올리버는 내게 희망이 있다고 말을 하면서 본인 주머니에 있던 약초 가루 한 봉지를 내 손에 쥐여줬다.
올리버: 이 약초 가루를 물에 타서 매일 아침 점심 저녁 3잔씩 먹으면 돼요...
저는 이제 다시 집으로 돌아가 볼 테니 어서 이것을 챙기고 도망가세요!"|SCENE_STORY_OUTSIDE(LOAD_HELL).jpg|ITEM_HERBALPOWDER.png||||214|||
214|"올리버는 나에게 말을 마치고는 마을이 있는 곳으로 돌아갔다.
... 내가 여태 먹은 미트파이가... 그렇게 맛있는 미트파이가...
사람이라고...? 그리고 요리사가 중독 약물을 첨가해서... 마을 사람들을 중독시키고 있다고...?
말도 안 돼... 이제 어떻게 해야 하지...?"|SCENE_STORY_OUTSIDE(LOAD_HELL).jpg||||도망간다|215|마을로 돌아간다|234|
215|"사... 사람을 먹을 순 없지... 집에 가서 짐 몇 개만 챙기고 도망가야겠어...!! 
나는 집으로 가서 몇 가지 짐만 챙기기로 마음먹고 집으로 향했다."|SCENE_STORY_OUTSIDE(LOAD_HELL).jpg|||||216|||
216|"집을 도착해서 정신없이 짐을 챙기고 있는데 갑자기 의문이 들었다. 
잠깐만... 내가 만약 도망가서 신고를 하면...? 이 마을은 없어질 거고... 그러면.... 
미.. 미트파이를 못 먹게 되는 거 아니야...? 이 맛있는 것을... 못 먹는다고...?"|SCENE_STORY_INSIDE(HOUSE_MY_HELL).jpg||||도망간다|217|광장으로 간다|220|
217|"그래도!! 사람을 먹는 건 도리가 아니지... 어떻게 사람을 미... 미트파이...? 
먹고 싶다 미... 트파이... 아니! 내가 왜 이러지??"|SCENE_STORY_INSIDE(HOUSE_MY_HELL).jpg||||도망간다|218|광장으로 간다|220|
218|"정신 차려 김기자!!! 빨리 나가서 미트파이에 대한 진.. 실... 미트파이... 
미트파이를 못 먹는다면... 나... 난 너무 불행할 것 같은데..."|SCENE_STORY_INSIDE(HOUSE_MY_HELL).jpg||||도망간다|219|광장으로 간다|220|
219|"도망..? 내가 왜 도망을 가지...? 
미트파이 먹을 시간이 다가오는데... 도망...? 미트파이를 먹는 게 더 생산적인 일이 아닐까...?"|SCENE_STORY_INSIDE(HOUSE_MY_HELL).jpg||||도망간다|220|광장으로 간다|220|
220|"도망... 도망... 도망!!! 그놈의 도망!!! 그만 생각해.. 
좀 있으면 미트파이를 먹으러 갈 시간이야... 흐흐흐...
미트파이를 포기할 순 없지.. 광장으로 나가자...
나는 더 이상 생각하지 않기로 마음먹고 광장으로 향했다."|SCENE_STORY_INSIDE(HOUSE_MY_HELL).jpg|||||221|||
221|"저녁 7시 광장으로 나가자 역시 많은 사람이 탁자에 앉아있었고, 저 멀리 올리버가 놀란 눈으로 나를 바라보고 있었다. 
나는 내 자리로 가서 미트파이가 나오기를 기다렸다.
잠시 후 이장과 요리사가 식당에서 미트파이를 가져와 사람들에게 나눠주기 시작했다. 
미트파이!!! 그래... 어떻게 이걸 포기해... 
나는 미트파이가 내 앞에 놓이자마자 미친 듯이 먹기 시작했다."|SCENE_STORY_INSIDE(PLAZA_HELL).jpg|||||222|||
222|"우걱우걱 쩝쩝쩝 우걱우걱 우걱우걱
너!!!!!!!!무 맛있어!!!! 하... 너무행복해...."|SCENE_STORY_INSIDE(PLAZA_HELL).jpg|||EFFECT_SOUND_EATING.wav||223|||G
223|우걱우걱 쩝쩝쩝 우걱우걱 우걱우걱|SCENE_STORY_INSIDE(PLAZA_HELL).jpg|||EFFECT_SOUND_EATING.wav||224|||G
224|"어..? 내 미트파이.. 어디갔지...? 
벌써 다 먹은 건가...? 
나는 내 미트파이가 담겨 있던 빈 접시를 바라봤다. 
너무 적어... 더 먹고 싶어... 내일을 기다리기에는 너무 오래 남았는데... 
잠깐만... 내가... 올리버를 고발하면... 잘했다고 더 주지 않을...까?
하지만 올리버는 나를... 도와주려고 했는데..."|SCENE_STORY_INSIDE(PLAZA_HELL).jpg||||고발한다|226|참고 집으로 돌아간다|225|
225|"참아..? 그러면 미트파이를 못 먹잖아...
미트파..이.. 이 맛있는걸... 참으라고...?
제 정신인가...?"|SCENE_STORY_INSIDE(PLAZA_HELL).jpg||||고발한다|226|참고 집으로 돌아간다|226|
226|이걸... 어떻게 참아!!! 나는 참지 못하고 자리에서 일어나 조용히 이장에게 다가갔다.|SCENE_STORY_INSIDE(PLAZA_HELL).jpg|||||227|||
227|"이장님... 
이장: ... 무슨 일인가?
나는 그동안 내가 봤던 것들과 올리버에게 도움받았던 것들을 모두 이장에게 귓속말로 전했다.
이장: ... 그런 일이 있었군.. 알았네
내 말에 표정이 굳어진 이장은 곧 옆 사람에게 작게 말했다."|SCENE_STORY_INSIDE(PLAZA_HELL).jpg|CHARACTER_MASTER_LEE(HELL).png||||228|||
228|그 사람은 다시 몇몇 사람에게 이야기를 전했고, 이내 여러 명이 몰려가 올리버를 잡았다.|SCENE_STORY_INSIDE(PLAZA_HELL).jpg|||||229|||
229|"올리버: ...?? 뭐야??? 왜 이러는 건데??? 놔!!! 
김기자!!! 설마.. 네가 나..를? 
야 이 나쁜 새끼야!!!
올리버는 사람들에게 끌려가며 나에게 소리쳤고 나는 그를 무시하고 이장을 바라보며 말했다."|SCENE_STORY_INSIDE(PLAZA_HELL).jpg|CHARACTER_OLIVER_HELL.png||||230|||
230|"그..그럼 미트파이... 미트파이를 좀 더 주시는 건가요...? 
이장: ... 알겠네. 불순한 의도를 가진 자를 찾아내 줬으니 선물을 줘야겠지... 
이장은 식당으로 들어가더니, 미트파이를 들고나와 나에게 건네줬다.
가..감사합니다! 감사합니다!!!"|SCENE_STORY_INSIDE(PLAZA_HELL).jpg|CHARACTER_MASTER_LEE(HELL).png||||231|||
231|"우걱우걱우걱 쩝쩝...
나는 미트파이를 낚아채듯 받아서는 미친 듯이 먹기 시작했다 
이맛이야... 이맛!! 이 눈물 나도록 맛있는 맛... 하... 너무 맛있어..."|SCENE_STORY_INSIDE(PLAZA_HELL).jpg|||EFFECT_SOUND_EATING.wav||232|||G
232|나는 추가로 얻은 미트파이를 마저 먹고 더 먹고 싶었지만... 아쉬움을 뒤로한 채 집으로 돌아가 잠을 청했다.|SCENE_STORY_INSIDE(PLAZA_HELL).jpg|||||235|||C
233|"미트..파이 재료를… 알 수 있을텐데… 휴고를 따라가 보는 게 맞지 않을까…?
미트파이… 따라가자…
나는 다시 휴고를 미행하기로 마음을 바꿔 먹었다."|SCENE_STORY_TOWN(HELL).jpg||BGM_STORY_CLIMAX(MOUNTAIN PATH).mp3|||198|||
234|"미트파이를 포기할 순 없지.. 집으로 돌아가자... 
나는 집으로 돌아가서 저녁이 되기를 기다렸다.
저..저녁이 됐으니.. 미..미트파이…먹으러가자…
나는 광장으로 향했다."|SCENE_STORY_INSIDE(HOUSE_MY_HELL).jpg|||||221|||
235|"나는, 오늘도 꿈을 꾸었다. 
그곳에서 여러 사람이 돌아다니는 것을 보았다. 내 손에는 망치가 들려 있었다.
나는 망설임 없이 사람들을 내려쳤고, 바닥에 떨어진 미트파이를 
가방에 담은 후 또 다른 사람들을 찾아 돌아다녔다. 
더 많은 미트파이를 얻기 위해."|SCENE_DREAM4.jpg|||||236|||
236|"나는 앞으로도... 
미트파이를... 위해... 마.. 을을 떠나지... 않을... 것... 이며..."|SCENE_DREAM4.jpg|||||237|||C
237|"미트... 파... 이를 위... 해... 살아갈... 것... 이고... 
미... 트파... 이를... 위... 해..여..행객..을..."|SCENE_DREAM4.jpg|||||238|||C
238|"미... 트... 파이... 를 위... 해... 
미... 트... 파... 이를... 미... 트... 미트... 파이..."|SCENE_DREAM4.jpg|||||239|||C
239||SCENE_BLACK_MEATPIE.jpg|||||240|||B
240|-END-|SCENE_GAME_END.jpg||BGM_TOTAL_ENDING.mp3|||1000|||
241|"미트파이도 미트파이지만… 너무 피곤하다.. 일단 좀 자자…
나는 긴 이동시간으로 쌓인 피로 때문에 침대에 눕자마자 곯아떨어졌다."|SCENE_STORY_INSIDE(HOUSE_MY).jpg||BGM_STORY_INTRO.mp3|||242|||
242|"음냐.. 완전 뻗었었네… 지금이 몇 시지…
6시 50분이네.. 7시에 광장에서 미트파이를 먹는다고 했었는데…
배가 고프기도 하고 졸리기도 하고… 더 잘까? 아니면 광장으로 나갈까?"|SCENE_STORY_INSIDE(HOUSE_MY).jpg||||잔다|254|광장으로 나간다|243|
243|"그래도 마을 사람들이랑 얼굴도 익히고.. 배도 채울 겸 가봐야겠다.. 
나는 나갈 채비를 해서 광장으로 향했다. 
마을 광장으로 향한 나는 조금 불쾌한 듯한 냄새를 맡을 수 있었다. 
어.. 무슨 냄새지.. 좀 역한 거 같은데… 
냄새에 대한 이런저런 생각을 하며 광장에 도착하자 여러 사람이 탁자에 앉아 있는 것을 확인할 수 있었다. 
안녕하세요!!! 이번에 이사 오게 된 김기자입니다!!! 
나는 둘러앉아있는 사람들이 모두 들을 수 있는 정도로 큰 소리로 인사했다. 
음...? 왜 다들 아무 반응이 없지? 
보통 인사하면 한 명쯤이라도 반응을 해야 되는 거 아닌가?
인사를 한 후 탁자에 앉아있는 마을 사람들을 둘러봤지만, 다들 좀 흐리멍덩한 눈으로
나를 바라봤다. 그중에 한 사람은 노려보는 듯한 느낌이었지만, 딱히 나에게 말을 하진 않았다.
아무도 말을 하지 않고 나를 쳐다보고 있는 게 뻘쭘해질 때쯤 식당에서 요리사와 이장이 나오면서 나에게 말을 건넸다."|SCENE_STORY_INSIDE(PLAZA).jpg|||||244|||
244|"이장: 자네 왔구만.. 왜 자리에 앉지 않고 그렇게 서있나?
아... 모두에게 인사를 했는데 다들 말씀이 없으셔서...
이장: ... 아... 다들 좀 숫기가 없고 너무 오랜만에 외지에서 사람이 와서 그런 것 같네. 친해지면 다들 좋은 사람이니 일단 자리에 앉게나 식사해야지.
네 알겠습니다."|SCENE_STORY_INSIDE(PLAZA).jpg|CHARACTER_MASTER_LEE.png||||245|||
245|"이장의 말 덕에 뻘쭘함에서 벗어날 수 있었던 나는 빈자리에 가서 앉았다.
이후 이장도 자리에 앉고 나니 요리사가 가져온 미트파이를 소분하여 사람들 앞에 내려놓기 시작했다."|SCENE_STORY_INSIDE(PLAZA).jpg|||||246|||
246|"요리사: 자자 오늘 미트파이도 아주 맛있게 나왔습니다!
다들 맛있게 드세요!!"|SCENE_STORY_INSIDE(PLAZA).jpg|CHARACTER_COOKER_SMILE.png||||247|||
247|"주민들은 다들 자기 앞에 미트파이가 놓이는 순간 걸신들린 귀신처럼 게걸스럽게 미트파이를 먹기 시작했다.
일을 너무 많이 해서 배가 많이 고팠나...? 저렇게까지 먹는다고??"|SCENE_STORY_INSIDE(PLAZA).jpg|||||248|||
248|"이장: 다들 오늘 낮에 밥도 못 먹고 일을 해서 배가 많이 고팠던 것 같구만, 자네도 어서 들지
사람들의 먹는 모습을 보며 놀란 표정을 짓는 나에게 이장이 말을 했다.
..하하.. 네 이장님도 맛있게 드세요!"|SCENE_STORY_INSIDE(PLAZA).jpg|CHARACTER_MASTER_LEE.png||||249|||
249|"나는 미트파이를 먹으려 했지만, 어딘가 불쾌한 냄새, 미트파이를 먹는 사람들의 이상한 행동으로 인해 
무언가 께름칙함을 느꼈다. 미트파이를 먹을까?"|SCENE_STORY_INSIDE(PLAZA).jpg||||미트파이를 먹는다|255|속이 안좋다하고 집에 돌아간다|250|
250|"… 아무래도 이 미트파이를 먹기에는 좀.. 찝찝한 것 같아.. 먹지 말고 집으로 돌아간다고 하자.
나는 말없이 조용히 미트파이를 들고 자리에서 일어났다."|SCENE_STORY_INSIDE(PLAZA).jpg|||||251|||
251|"이장: … 왜 갑자기 일어나는 겐가? 
아… 지금 사실 속이 좀 좋지 않아서요… 오늘은 집에 가서 좀 쉬고 내일 아침에 먹으려구요. 
이장: … 여기까지 오느라 피곤해서 그런가 보군. 알겠네 어여 들어가서 쉬게나. 
네! 다들 식사 맛있게 하세요! 
나는 이장님과 다른 주민들에게 크게 인사하고 미트파이를 들고 집에 왔다."|SCENE_STORY_INSIDE(PLAZA).jpg|CHARACTER_MASTER_LEE.png||||252|||
252|"… 이 미트파이는 당분간 먹으면 안 되겠어… 
뭔가 쎄한 느낌을 주는 미트파이를 나는 먹지 않기로 마음먹었다.
그리고 나는 낮에 받은 미트파이와 방금 가져온 미트파이를 쓰레기통에 버렸다."|SCENE_STORY_INSIDE(HOUSE_MY).jpg|||||253|||
253|"하~암… 낮에 그리 잤는데도 피곤하네… 빨리 자야겠다.
정말 피곤한 하루였어..
나는 침대에 누워서 잠을 청했다."|SCENE_STORY_INSIDE(HOUSE_MY).jpg|||||254|||C
254|"하~암… 낮에 그리 잤는데도 피곤하네… 배가 고프긴 하지만..
그냥 더 자자…
나는 다시 눈을 감았다."|SCENE_STORY_INSIDE(HOUSE_MY).jpg|||||257|||C
255|"그래도 첫날인데… 처음부터 안 먹고 일어나면… 그렇겠... 지? 
나는 미트파이를 먹기 시작했다. 
쩝쩝… 윽… 좀 역한데…. 쩝쩝… 
뭔지 모를 찝찝함과… 역한 냄새가 정말 맘에 안 드는 미트파이였다. 
쩝쩝… 먹다 보니 괜... 찮은 것 같... 기도…? 
나는 미트파이를 모두 먹어 치웠다. 
휴.. 먹다 보니 역한 냄새도 사라진 것 같고… 맛도... 생각보다 괜찮은 것 같았다."|SCENE_STORY_INSIDE(PLAZA).jpg|||||256|||
256|"밥을 다 먹었으니 이제 집에 가서 자자.
나는 집으로 가서 잠을 청했다."|SCENE_STORY_INSIDE(PLAZA).jpg|||||294|||C
257|"다음날, 나는 알람 소리에 잠에서 깼다.
빠빠빠 빱빱 빱빠빠빱 빠빱 밥 빠빠빠 빱빱 빱빠빠빱 빠빱 밥 ... . 틱!"|SCENE_STORY_INSIDE(HOUSE_MY).jpg|||||258||C|
258|"으아…! 잠을 좀 많이 잤더니 개운하네
어제 한 끼도 안 먹었더니… 배가 너무 고픈데… 아! 어제 비행기 타기 전에 샀던 간식들!"|SCENE_STORY_INSIDE(HOUSE_MY).jpg|||||259|||
259|"나는 허기를 달래기 위해 어제 사놨던 간식을 먹었다. 
쩝쩝쩝… 음… 양이 너무 적어… 좀 나가서 먹을 걸 구할 곳이 있나 둘러봐야겠다."|SCENE_STORY_TOWN(INTRO).jpg|||||260|||
260|"나는 어제 인사 못한 주민들에게 인사도 하고, 음식 거리도 구할 겸 밖으로 나왔다.
저기 집 앞에 앉아서 망치를 손질하는 사람이 보이고... 반대편에는 구멍가게 같은 게 보이는데... 어디로 가볼까?"|SCENE_STORY_TOWN(INTRO).jpg||||망치를 손질하는 사람|298|구멍가게|261|
261|"일단 집에 먹을 것도 없고... 생필품도 좀 사야 될 거 같은데
구멍가게로 가보자!
나는 구멍가게로 보이는 집으로 향했다."|SCENE_STORY_TOWN(INTRO).jpg|||||262|||
262|"그곳에는 각종 인스턴트식품과, 건어물류, 그리고 구멍가게에서 직접 말린 것 같은 육포, 그리고 뉴질랜드 특산품인 키위가 있었다.
안녕하세요! 계신가요?
나는 구멍가게에 들어서며 크게 인사했다."|SCENE_STORY_INSIDE(SHOP).jpg|||||263|||
263|"구멍가게 주인: ... 누구신가? 
구석 카운터에 앉아서 무언가를 작성하고 있던 구멍가게 주인이 나에게 물었다. 
아. 안녕하세요! 어제 식당에서 크게 인사드렸던 이번에 이사 온 김기자라고 합니다. 
집에 먹을 게 없어서 좀 구매하려고 왔어요! 
구멍가게 주인: 아 새로 온 주민이시구나. 뭐 필요한 거 잘 둘러보세요. 저기는 생필품이고, 음식과 음료들은 이쪽에 있습니다. 
다 고른 다음에 부르게 
구멍가게 주인은 자기 할 말이 끝나자 다시 작성하고 있던 노트에 집중하기 시작했다. 
음 일단... 키위랑... 컵라면... 음료수랑, 생필품도 좀 사고... 
이 육포는... 좀 이상한 냄새가 나는 것 같은데?? 
이건 사지 말자 
사장님! 이것들 구매할게요! 
나는 계산을 하고 나와 집으로 가져갔다.
후! 그러면 이제 집에서 먹을 것들이랑 생필품은 모두 해결한 건가??
이제 곧 점심시간이긴 한데… 뭐 먹지?"|SCENE_STORY_INSIDE(HOUSE_MY).jpg||||컵라면 먹는다|264|키위를 먹는다|299|
264|"키위는 간식이지… 컵라면이나 먹어야겠다! 
나는 컵라면에 물을 부어 먹었다."|SCENE_STORY_INSIDE(HOUSE_MY).jpg|||||265|||
265|"크… 역시 라면은 진리지…
누가 만들었는지 모르지만 정말 잘 만들었어.
맛있게 라면을 먹은 후 나는 다시 주민들에게 인사 좀 하고자 밖으로 나왔다.
음... 아까 망치 손질하던 사람은 안 보이고… 어제 요리사분에게 인사를 해볼까?"|SCENE_STORY_INSIDE(HOUSE_MY).jpg|||||266|||
266|밖에 나온 나는 주변에 보이는 사람이 없어 어제 요리사분에게 인사를 하고자 식당으로 향했다.|SCENE_STORY_INSIDE(REST).jpg|||||267|||
267|"끼이익 - 탁
안녕하세요! 요리사님!!
나는 식당에 들어가면서 크게 인사했다."|SCENE_STORY_INSIDE(REST_INSIDE).jpg|||||268|||
268|"쾅 쾅쾅!! 서걱 서걱 서걱... 쾅!! 쾅!! 
요리사의 대답은 들을 순 없었지만, 주방에서 들려오는 소리로 요리사가 주방 일을 하고 있다는 것을 알 순 있었다."|SCENE_STORY_INSIDE(REST_INSIDE).jpg|||EFFECT_SOUND_MAKING(KITCHEN).wav||269|||G
269|"재료 손질하느라 많이 바쁜 거 같은데... 
어쩌지??? 주방으로 들어가 볼까? 아니면 한 번 더 크게 소리 질러 볼까?"|SCENE_STORY_INSIDE(REST_INSIDE).jpg||BGM_STORY_INTRO.mp3||들어간다|301|한번 더 소리 지른다|270|
270|"그래도 허락 없이 주방을 들어가는 건 실례지…
저기요!!! 요리사님!!!!
나는 주방을 향해 한 번 더 크게 소리쳤다."|SCENE_STORY_INSIDE(REST_INSIDE).jpg|||||271|||
271|쾅 쾅쾅쾅!! 서걱 서걱 쾅쾅쾅! 뚝!|SCENE_STORY_INSIDE(REST_INSIDE).jpg|||EFFECT_SOUND_MAKING(KITCHEN).wav||272|||G
272|"내 소리를 들은 건지 주방에서 나는 소리가 멈췄다.
잠시 후 주방 커튼을 치며 요리사가 나왔다."|SCENE_STORY_INSIDE(REST_INSIDE).jpg|||||273|||
273|"요리사: …누구시죠? 
요리사는 나를 경계하는 표정을 지으며 물었다. 
아… 저는 어제 이 마을로 이사 온 김기자라고 합니다! 인사차 들렸어요 
요리사: 아… 어제 미트파이를 안 먹고 집으로 돌아가신 분이시군요... ? 
요리사는 눈빛이 차가워지며 물었다. 
하하… 어제 제가 좀 기... 긴 시간 비행기 타고 마을에 온 거라... 속이 너무 안 좋아서 들어간 거였어요. 그 미트파이는 오늘 아침에 맛있게 먹었습니다!
나는 요리사의 눈빛이 미트파이를 안 먹었으면 마치 죽일 것 같은 느낌이 들어, 나도 모르게 거짓말을 했다."|SCENE_STORY_INSIDE(REST_INSIDE).jpg|CHARACTER_COOKER.png||||274|||
274|요리사: … 하하하 그렇군요! 제 요리를 안 드신 것 같아 좀 서운했었는데… 오늘 드셨다니 마음이 좀 풀리네요|SCENE_STORY_INSIDE(REST_INSIDE).jpg|CHARACTER_COOKER_SMILE.png||||275|||
275|"반갑습니다! 앞으로 잘 지내봐요. 
내가 미트파이를 먹었다고 말하자 요리사는 표정을 풀고 웃으며 말했다. 
하하... 네! 앞으로 잘 부탁드립니다. 저는 이제 다른 분들에게도 인사드리러 나가볼게요! 
나는 요리사에게 인사를 마치고 도망치듯 식당 밖으로 나왔다."|SCENE_STORY_INSIDE(REST_INSIDE).jpg|CHARACTER_COOKER_SMILE.png||||276|||
276|"무슨 요리사가 이렇게 섬뜩하지…
밖으로 나오니 왼쪽 멀리 어제 날 노려보던 사람이 보이고, 오른쪽에는 망치를 손질하던 사람이 자루를 하나 들고 가는 것을 볼 수 있었다.
누구에게 말을 걸어볼까?"|SCENE_STORY_TOWN(INTRO).jpg||||노려보던 사람|277|망치를 손질하던 사람|309|
277|"저녁 시간에 대부분 멍한 표정이었던 다른 주민들과 달리 뭔가... 나를 노려봤던 사람에게 가볼까? 
나는 왼쪽에 있는 사람에게 다가갔다."|SCENE_STORY_TOWN(INTRO).jpg|||||278|||
278|"안녕하세요!!!
노려봤던 사람: ... 
나는 그 사람에게 다가가 밝게 인사했지만, 그 사람은 대답하지 않았다.
여기 마을 사람들은 입에 본드가 붙었나…"|SCENE_STORY_TOWN(INTRO).jpg|||||279|||
279|"저... 안녕하세요!! 이번에 이사 온 김기자라고 합니다. 
노려보던 사람: ... 반갑습니다. 저는 올리버라고 합니다. 
무시당해도 두 번이나 인사를 했더니, 못마땅한 표정으로 인사에 답해줬다. 
하하 그래도 인사받아주셨네요. 어제도 그렇고 다들 인사만 하면 표정이 굳거나 말이 없으셔서... 입에 본드가 붙은 줄 알았지, 뭐예요 하하 
올리버: ... 마을 사람들이 원래 좀 말이 없습니다. 그러려니 하시는 게 좋아요. 
아! 뭔가 만들고 계신 거였군요. 냄새가... 향긋하네요... 
올리버: ... ! 혹시 이사 오셔서 미트파이를 몇 번 드셨나요? 
갑자기 왜 미트파이 먹은 것을 물어보지... ? 거짓말해야 하나? 
미트파이를 좀 수상하게 여기고 있던 나는 올리버의 질문에 대답을 바로 하지 못했다. 
올리버: … 안 드신 것 같군요. 잘하셨어요.
네? 잘했다구요?
안 먹어서 잘했다니…? 무슨 소리지?"|SCENE_STORY_TOWN(INTRO).jpg|CHARACTER_OLIVER_INTRO.png||||280|||
280|"올리버: 자세한 건… 말씀드릴 순 없지만. 만약 앞으로 미트파이를 먹어야 하는 상황이 온다면 
꼭!! 먹고 난 다음에 이 가루를 한 숟갈 물에 타드세요! 안 드시면 후회하실 겁니다."|SCENE_STORY_TOWN(INTRO).jpg|ITEM_HERBALPOWDER.png||||281|||
281|"예???
올리버: 그리고 이 이야기는 우리들의 비밀로 하셔야 될 거예요. 전 할 일이 있어서 이만 가보겠습니다.
올리버는 나에게 흰 가루가 담긴 주머니를 주고 자리에서 벗어났다."|SCENE_STORY_TOWN(INTRO).jpg|CHARACTER_OLIVER_INTRO.png||||282|||
282|"이 가루는 뭐지…? 미트파이에 뭐가 있는 건가? 
나는 뭔가 이상함을 느꼈지만, 미트파이에 대해 느낀 위화감 때문에 그 가루 주머니를 챙겨 넣었다.
시간을 보니... 7시가 다 된 것 같은데… 어쩌지 광장으로 가야 하나?"|SCENE_STORY_TOWN(INTRO).jpg||||광장으로 간다|283|집에 가서 쉰다|312|
283|"그래도... 마을에서 다 같이 가지는 시간인데… 나가야지 
나는 나가기로 마음먹고 광장으로 향했다.
광장에 도달할 즘 어제 맡았던 조금 불쾌한 냄새가 나기 시작했다."|SCENE_STORY_TOWN(INTRO).jpg|||||284|||
284|"윽... 이 냄새는 적응이 안 되네... 벌써 속이 울렁거리는 것 같네… 
나는 눈이 마주치는 마을 사람들에게 가볍게 묵례로 인사를 하며 내 자리에 앉았다.
잠시 뒤 식당 문이 열리며 요리사와 이장이 미트파이를 가지고 나왔다."|SCENE_STORY_INSIDE(PLAZA).jpg|||||285|||
